id,name,description,best_for,pmm_domain,file,tags
document-template,"Product Marketing Context Template","Full 12-section template for building the product marketing context document covering positioning, messaging, personas, competitive landscape, and channel strategy.","Building product marketing context; positioning document; messaging framework; persona development; competitive analysis; brand voice definition","Template","document-template.md","template,positioning,messaging,personas"
brand-selection,"Brand Selection Protocol","Protocol for establishing which brand to work on before any product marketing context work.","Starting a new session; multiple brands available; need to establish brand context","Protocol","brand-selection.md","protocol,selection,multi-brand"
check-existing,"Check Existing Context","Process for checking existing product marketing context and SOSTAC files before building or updating.","Determining extraction vs interview mode; checking what already exists; SOSTAC availability","Protocol","check-existing.md","protocol,context-check,sostac"
auto-extract,"Auto-Extract from SOSTAC","Extract product marketing context from existing SOSTAC files rather than re-asking questions.","SOSTAC files available; extracting from existing strategy work; filling gaps only","Workflow","auto-extract.md","workflow,extraction,sostac,gap-filling"
focused-interview,"Focused Interview Protocol","3-round interview protocol for gathering context when no SOSTAC files exist.","No SOSTAC available; new brand; blank page strategy work; surfacing positioning","Workflow","focused-interview.md","workflow,interview,questions,probing"
document-operations,"Document Operations","Writing, updating, and maintaining the product marketing context document.","Writing the document; updating sections; syncing with brand context; post-writing steps","Operations","document-operations.md","operations,writing,updating,sync"
staleness-detection,"Staleness Detection","Freshness signals and review triggers for maintaining current product marketing context.","Document freshness; quarterly review; staleness indicators; validation status","Maintenance","staleness-detection.md","maintenance,freshness,review,validation"